{
  "schema_version": "0.2.0",
  "system": {
    "id": "process-cell-ambiguous",
    "name": "Synthetic process-cell ambiguous matching fixture"
  },
  "sources": [
    {
      "id": "src-example-bom",
      "type": "bom",
      "title": "Synthetic process-cell bill of materials"
    },
    {
      "id": "src-flowmeter-datasheet",
      "type": "datasheet",
      "title": "Synthetic flowmeter datasheet"
    },
    {
      "id": "src-example-topology",
      "type": "engineering_project",
      "title": "Synthetic two-channel current-input topology"
    }
  ],
  "assets": [
    {
      "id": "flowmeter-1",
      "name": "Flow sensor F-101",
      "asset_kind": "instance",
      "role": "sensor",
      "identification": {
        "manufacturer_name": "Example Manufacturer",
        "manufacturer_product_designation": "Example flowmeter",
        "manufacturer_product_code": "EXAMPLE-FLOW-4-20MA",
        "source_refs": [
          "src-example-bom",
          "src-flowmeter-datasheet"
        ]
      },
      "reference_designations": [
        {
          "system": "synthetic process cell",
          "aspect": "function",
          "value": "F-101"
        }
      ],
      "ports": [
        {
          "id": "measurement-output",
          "role": "signal",
          "direction": "output",
          "interface": {
            "kind": "analog_current",
            "signal_range": {
              "min": 4,
              "max": 20,
              "unit": {
                "symbol": "mA"
              }
            }
          },
          "engineering_range": {
            "quantity_name": "volume flow",
            "min": 0,
            "max": 600,
            "unit": {
              "symbol": "l/h"
            }
          },
          "source_refs": [
            "src-flowmeter-datasheet"
          ],
          "status": "declared"
        }
      ],
      "source_refs": [
        "src-example-bom",
        "src-flowmeter-datasheet"
      ],
      "status": "declared"
    },
    {
      "id": "io-module-1",
      "name": "Two-channel current input module",
      "asset_kind": "instance",
      "role": "io_module",
      "identification": {
        "manufacturer_name": "Example I/O Manufacturer",
        "manufacturer_product_designation": "Example two-channel current input module",
        "manufacturer_product_code": "EXAMPLE-AI-2CH",
        "source_refs": [
          "src-example-topology"
        ]
      },
      "ports": [
        {
          "id": "ch1",
          "role": "signal",
          "direction": "input",
          "channel_index": 1,
          "interface": {
            "kind": "analog_current",
            "signal_range": {
              "min": 4,
              "max": 20,
              "unit": {
                "symbol": "mA"
              }
            }
          },
          "source_refs": [
            "src-example-topology"
          ],
          "status": "observed"
        },
        {
          "id": "ch2",
          "role": "signal",
          "direction": "input",
          "channel_index": 2,
          "interface": {
            "kind": "analog_current",
            "signal_range": {
              "min": 4,
              "max": 20,
              "unit": {
                "symbol": "mA"
              }
            }
          },
          "source_refs": [
            "src-example-topology"
          ],
          "status": "observed"
        }
      ],
      "source_refs": [
        "src-example-topology"
      ],
      "status": "observed"
    }
  ],
  "physical_connections": [
    {
      "id": "candidate-flow-ch1",
      "kind": "signal",
      "endpoints": [
        {
          "asset_id": "flowmeter-1",
          "port_id": "measurement-output"
        },
        {
          "asset_id": "io-module-1",
          "port_id": "ch1"
        }
      ],
      "status": "candidate",
      "confidence": 0.5,
      "evidence": [
        {
          "source_ref": "src-flowmeter-datasheet",
          "detail": "Device output is 4-20 mA."
        },
        {
          "source_ref": "src-example-topology",
          "detail": "Channel 1 accepts 4-20 mA."
        }
      ]
    },
    {
      "id": "candidate-flow-ch2",
      "kind": "signal",
      "endpoints": [
        {
          "asset_id": "flowmeter-1",
          "port_id": "measurement-output"
        },
        {
          "asset_id": "io-module-1",
          "port_id": "ch2"
        }
      ],
      "status": "candidate",
      "confidence": 0.5,
      "evidence": [
        {
          "source_ref": "src-flowmeter-datasheet",
          "detail": "Device output is 4-20 mA."
        },
        {
          "source_ref": "src-example-topology",
          "detail": "Channel 2 accepts 4-20 mA."
        }
      ]
    }
  ]
}
